{
  "$id": "https://pm-center.local/schema/v1/component-manifest.schema.json",
  "$schema": "http://json-schema.org/draft-07/schema#",
  "additionalProperties": true,
  "definitions": {
    "Capability": {
      "enum": [
        "app.profile.read",
        "app.profile.write",
        "app.settings.read",
        "app.settings.write",
        "notification.send",
        "clipboard.read",
        "clipboard.write",
        "filesystem.dialog.open",
        "filesystem.external.read",
        "filesystem.external.write",
        "project.open",
        "project.files.read",
        "project.files.write",
        "project.metadata.read",
        "project.metadata.write",
        "cache.inspect",
        "cache.maintain",
        "task.run",
        "task.cancel",
        "python.execute",
        "python.packages.manage",
        "process.spawn",
        "network.http.request",
        "network.lan.discover",
        "network.lan.message",
        "network.lan.transfer",
        "network.server.connect",
        "render.inspect",
        "render.queue.read",
        "render.queue.write",
        "render.worker.execute",
        "render.result.commit"
      ],
      "type": "string"
    },
    "ComponentContributions": {
      "additionalProperties": true,
      "properties": {
        "dataSources": {
          "default": [],
          "items": {
            "type": "string"
          },
          "type": "array"
        },
        "settingsSections": {
          "default": [],
          "items": {
            "$ref": "#/definitions/ComponentSettingsSection"
          },
          "type": "array"
        },
        "toolActions": {
          "default": [],
          "items": {
            "$ref": "#/definitions/ToolActionContribution"
          },
          "type": "array"
        },
        "widgets": {
          "default": [],
          "items": {
            "type": "string"
          },
          "type": "array"
        },
        "workflowNodes": {
          "default": [],
          "items": {
            "$ref": "#/definitions/WorkflowNodeContribution"
          },
          "type": "array"
        }
      },
      "type": "object"
    },
    "ComponentDependency": {
      "properties": {
        "id": {
          "type": "string"
        },
        "versionRequirement": {
          "default": "*",
          "type": "string"
        }
      },
      "required": [
        "id"
      ],
      "type": "object"
    },
    "ComponentDistribution": {
      "enum": [
        "local",
        "bundled",
        "marketplace"
      ],
      "type": "string"
    },
    "ComponentResourceLimits": {
      "additionalProperties": true,
      "properties": {
        "maxMemoryMb": {
          "format": "uint64",
          "minimum": 0.0,
          "type": [
            "integer",
            "null"
          ]
        },
        "maxParallelism": {
          "format": "uint16",
          "minimum": 0.0,
          "type": [
            "integer",
            "null"
          ]
        },
        "timeoutMs": {
          "format": "uint64",
          "minimum": 0.0,
          "type": [
            "integer",
            "null"
          ]
        }
      },
      "type": "object"
    },
    "ComponentRole": {
      "enum": [
        "service",
        "feature",
        "data"
      ],
      "type": "string"
    },
    "ComponentRuntime": {
      "enum": [
        "python-action",
        "python-worker",
        "native-process",
        "native-library",
        "data-pack",
        "builtin-rust"
      ],
      "type": "string"
    },
    "ComponentSettingsSection": {
      "additionalProperties": true,
      "properties": {
        "description": {
          "default": "",
          "type": "string"
        },
        "fields": {
          "default": [],
          "items": {
            "$ref": "#/definitions/SettingsField"
          },
          "type": "array"
        },
        "id": {
          "type": "string"
        },
        "order": {
          "default": 0,
          "format": "int32",
          "type": "integer"
        },
        "scope": {
          "$ref": "#/definitions/SettingsScope"
        },
        "title": {
          "type": "string"
        }
      },
      "required": [
        "id",
        "scope",
        "title"
      ],
      "type": "object"
    },
    "ComponentUiMode": {
      "enum": [
        "none",
        "hosted",
        "contributed"
      ],
      "type": "string"
    },
    "PlatformTarget": {
      "enum": [
        "any",
        "windows-x64",
        "windows-arm64"
      ],
      "type": "string"
    },
    "PortDefinition": {
      "additionalProperties": true,
      "properties": {
        "description": {
          "default": "",
          "type": "string"
        },
        "name": {
          "type": "string"
        },
        "required": {
          "default": false,
          "type": "boolean"
        },
        "type": {
          "$ref": "#/definitions/PortValueType"
        }
      },
      "required": [
        "name",
        "type"
      ],
      "type": "object"
    },
    "PortValueType": {
      "enum": [
        "string",
        "integer",
        "number",
        "boolean",
        "json",
        "path",
        "file",
        "directory",
        "artifact",
        "string-list",
        "file-list"
      ],
      "type": "string"
    },
    "SettingsField": {
      "additionalProperties": true,
      "properties": {
        "defaultValue": true,
        "description": {
          "default": "",
          "type": "string"
        },
        "id": {
          "type": "string"
        },
        "label": {
          "type": "string"
        },
        "maximum": {
          "format": "double",
          "type": [
            "number",
            "null"
          ]
        },
        "minimum": {
          "format": "double",
          "type": [
            "number",
            "null"
          ]
        },
        "options": {
          "default": [],
          "items": {
            "$ref": "#/definitions/SettingsOption"
          },
          "type": "array"
        },
        "placeholder": {
          "type": [
            "string",
            "null"
          ]
        },
        "required": {
          "default": false,
          "type": "boolean"
        },
        "sensitive": {
          "default": false,
          "type": "boolean"
        },
        "type": {
          "$ref": "#/definitions/SettingsFieldType"
        }
      },
      "required": [
        "id",
        "label",
        "type"
      ],
      "type": "object"
    },
    "SettingsFieldType": {
      "enum": [
        "string",
        "integer",
        "number",
        "boolean",
        "path",
        "file",
        "directory",
        "enum",
        "string-list"
      ],
      "type": "string"
    },
    "SettingsOption": {
      "properties": {
        "label": {
          "type": "string"
        },
        "value": {
          "type": "string"
        }
      },
      "required": [
        "label",
        "value"
      ],
      "type": "object"
    },
    "SettingsScope": {
      "enum": [
        "global",
        "project"
      ],
      "type": "string"
    },
    "ToolActionContribution": {
      "additionalProperties": true,
      "properties": {
        "command": {
          "type": "string"
        },
        "id": {
          "type": "string"
        },
        "name": {
          "type": "string"
        }
      },
      "required": [
        "command",
        "id",
        "name"
      ],
      "type": "object"
    },
    "WorkflowNodeContribution": {
      "additionalProperties": true,
      "properties": {
        "command": {
          "type": "string"
        },
        "id": {
          "type": "string"
        },
        "inputs": {
          "default": [],
          "items": {
            "$ref": "#/definitions/PortDefinition"
          },
          "type": "array"
        },
        "name": {
          "type": "string"
        },
        "outputs": {
          "default": [],
          "items": {
            "$ref": "#/definitions/PortDefinition"
          },
          "type": "array"
        }
      },
      "required": [
        "command",
        "id",
        "name"
      ],
      "type": "object"
    }
  },
  "properties": {
    "apiVersion": {
      "type": "string"
    },
    "capabilities": {
      "default": [],
      "items": {
        "$ref": "#/definitions/Capability"
      },
      "type": "array"
    },
    "contributes": {
      "allOf": [
        {
          "$ref": "#/definitions/ComponentContributions"
        }
      ],
      "default": {
        "dataSources": [],
        "settingsSections": [],
        "toolActions": [],
        "widgets": [],
        "workflowNodes": []
      }
    },
    "description": {
      "default": "",
      "type": "string"
    },
    "distribution": {
      "allOf": [
        {
          "$ref": "#/definitions/ComponentDistribution"
        }
      ],
      "default": "local"
    },
    "entry": {
      "type": [
        "string",
        "null"
      ]
    },
    "id": {
      "type": "string"
    },
    "name": {
      "type": "string"
    },
    "optionalComponents": {
      "default": [],
      "items": {
        "$ref": "#/definitions/ComponentDependency"
      },
      "type": "array"
    },
    "platforms": {
      "default": [],
      "items": {
        "$ref": "#/definitions/PlatformTarget"
      },
      "type": "array"
    },
    "publisher": {
      "type": [
        "string",
        "null"
      ]
    },
    "requiresComponents": {
      "default": [],
      "items": {
        "$ref": "#/definitions/ComponentDependency"
      },
      "type": "array"
    },
    "resources": {
      "allOf": [
        {
          "$ref": "#/definitions/ComponentResourceLimits"
        }
      ],
      "default": {}
    },
    "role": {
      "allOf": [
        {
          "$ref": "#/definitions/ComponentRole"
        }
      ],
      "default": "service"
    },
    "runtime": {
      "$ref": "#/definitions/ComponentRuntime"
    },
    "schemaVersion": {
      "const": 1,
      "format": "uint16",
      "minimum": 0.0,
      "type": "integer"
    },
    "uiMode": {
      "allOf": [
        {
          "$ref": "#/definitions/ComponentUiMode"
        }
      ],
      "default": "none"
    },
    "version": {
      "type": "string"
    }
  },
  "required": [
    "apiVersion",
    "id",
    "name",
    "runtime",
    "schemaVersion",
    "version"
  ],
  "title": "ComponentManifestV1",
  "type": "object"
}
